{
  "$schema": "https://json-schema.org/draft/2020-12/schema",
  "$comment": "No $id on purpose: every Rulebook schema is addressed by its file location (docs/reference/naming.md section 6).",
  "title": "Rulebook twin pairs",
  "description": "base/twins.json of an organization rulebook repository (generated from docs/rulebook/matrix/twins.json in the engine): the PerTenantExtensionCop and AppSourceCop twin pairs the twins setting acts on (D23). That count equals the number of pairs is validation check C14. See docs/reference/naming.md.",
  "$defs": {
    "pair": {
      "type": "object",
      "required": ["pte", "appsource"],
      "properties": {
        "pte": { "type": "string", "pattern": "^PTE[0-9]{4}(?![\\s\\S])" },
        "appsource": { "type": "string", "pattern": "^AS[0-9]{4}(?![\\s\\S])" },
        "title": { "type": "string" }
      },
      "additionalProperties": false
    }
  },
  "type": "object",
  "required": ["pairs"],
  "properties": {
    "$schema": { "type": "string" },
    "generatedBy": { "type": "string" },
    "setting": { "const": "twins" },
    "values": { "const": ["both", "appsource", "pte"] },
    "count": { "type": "integer", "minimum": 0 },
    "pairs": { "type": "array", "items": { "$ref": "#/$defs/pair" } }
  },
  "additionalProperties": false
}
